RECORDING_SESSION_LABEL,comprehension_score_without_reread,comprehension_score_reread,trials,Trial_Index_,session_interruptions_(recalibrations),total_recalibrations,num_trials_without_recalibrations,session_duration,total_duration,DURATION,START_TIME,END_TIME,EYE_TRACKED,total_blinks,blinks_per_min,total_average_blink_duration,BLINK_COUNT,AVERAGE_BLINK_DURATION,batch_condition,batch,list,article_id,article_ind,level,level_ind,paragraph_id,q_ind,question,a,ID,dominant eye,Start Time,MIT/Technion,Experimenter,LEXTALE,Mich-Test,Experiment Notes,Survey notes,age,gender,native_speaker,home_country,english_speaking_country,stat_learning_english,years_in_english_country,percentage_in_en_country_out_of_life,additional_languages,balanced_bilinguals,education,affiliated,institution,multilingual,impairment,vision_impairment
l13_1019,89.0,100.0,"[3, 4, 5, 6, 7, 8, 9, 10, 11, 12, 13, 14, 15, 16, 17, 18, 19, 20, 21, 22, 23, 24, 25, 26, 27, 28, 29, 30, 31, 32, 33, 34, 35, 36, 37, 38, 39, 40, 41, 42, 43, 44, 45, 46, 47, 48, 49, 50, 51, 52, 53, 54, 55, 56]","[4, 5, 7, 8, 9, 10, 11, 13, 16, 17, 18, 21, 22, 23, 24, 25, 26, 28, 29, 30, 32, 33, 34, 35, 36, 38, 40, 41, 42, 45, 47, 49, 51, 56, 58, 59, 61, 64, 65, 66, 70, 74, 76, 77, 79, 80, 81, 82, 83, 84, 85, 86, 87, 88]",30,44,54,62.06388333333334,127.71871666666667,"[67142, 80481, 49601, 56918, 56462, 58891, 61152, 58887, 67804, 83142, 47709, 62417, 44180, 115591, 57863, 33505, 60226, 49183, 53569, 44518, 52800, 64628, 37121, 52001, 67330, 31649, 55938, 80609, 62689, 75699, 61405, 83371, 57149, 54799, 80780, 67075, 69793, 50303, 56074, 62512, 55885, 90961, 49314, 52210, 42759, 40831, 60832, 51069, 37722, 29984, 35928, 47041, 30419, 29313]",53.48116666666667,181.19988333333333,L,701,11.294813704051712,124.55215384615384,"[16, 20, 10, 11, 10, 12, 14, 9, 16, 20, 6, 14, 8, 26, 8, 6, 15, 7, 10, 9, 14, 10, 8, 11, 12, 7, 5, 18, 22, 11, 17, 25, 7, 9, 22, 22, 20, 7, 10, 10, 8, 18, 13, 8, 8, 6, 9, 9, 9, 5, 6, 8, 4, 6]","[100.62, 107.5, 124.2, 100.45, 160.2, 98.25, 105.43, 116.33, 125.88, 118.35, 123.67, 135.21, 110.62, 153.92, 130.0, 151.17, 133.0, 106.43, 101.4, 105.11, 166.71, 100.6, 99.38, 102.82, 122.67, 146.86, 130.2, 147.61, 160.41, 154.64, 157.65, 209.4, 160.57, 122.89, 187.41, 132.55, 167.1, 137.14, 111.5, 115.7, 124.0, 173.39, 144.85, 194.0, 86.88, 107.33, 80.89, 102.56, 106.44, 85.6, 91.5, 118.38, 81.0, 125.17]",n,1,13,"[2, 2, 2, 2, 2, 2, 7, 7, 7, 7, 5, 5, 5, 5, 5, 9, 9, 9, 9, 9, 9, 1, 1, 1, 1, 1, 1, 1, 4, 4, 4, 4, 4, 8, 8, 8, 8, 8, 10, 10, 10, 10, 10, 10, 10, 6, 6, 6, 6, 3, 3, 3, 3, 3]","[1, 1, 1, 1, 1, 1, 2, 2, 2, 2, 3, 3, 3, 3, 3, 4, 4, 4, 4, 4, 4, 5, 5, 5, 5, 5, 5, 5, 6, 6, 6, 6, 6, 7, 7, 7, 7, 7, 8, 8, 8, 8, 8, 8, 8, 9, 9, 9, 9, 10, 10, 10, 10, 10]","['Adv', 'Adv', 'Ele', 'Ele', 'Ele', 'Adv', 'Ele', 'Ele', 'Adv', 'Adv', 'Adv', 'Adv', 'Ele', 'Adv', 'Ele', 'Ele', 'Adv', 'Adv', 'Ele', 'Ele', 'Ele', 'Ele', 'Ele', 'Adv', 'Adv', 'Adv', 'Ele', 'Adv', 'Ele', 'Ele', 'Adv', 'Adv', 'Ele', 'Ele', 'Adv', 'Adv', 'Adv', 'Ele', 'Adv', 'Ele', 'Adv', 'Adv', 'Adv', 'Ele', 'Ele', 'Adv', 'Ele', 'Adv', 'Ele', 'Adv', 'Ele', 'Adv', 'Ele', 'Ele']","[0, 0, 2, 2, 2, 0, 2, 2, 0, 0, 0, 0, 2, 0, 2, 2, 0, 0, 2, 2, 2, 2, 2, 0, 0, 0, 2, 0, 2, 2, 0, 0, 2, 2, 0, 0, 0, 2, 0, 2, 0, 0, 0, 2, 2, 0, 2, 0, 2, 0, 2, 0, 2, 2]","[1, 2, 3, 4, 5, 6, 1, 2, 3, 4, 1, 2, 3, 4, 5, 1, 2, 3, 4, 5, 6, 1, 2, 3, 4, 5, 6, 7, 1, 2, 3, 4, 5, 1, 2, 3, 4, 5, 1, 2, 3, 4, 5, 6, 7, 1, 2, 3, 4, 1, 2, 3, 4, 5]","[1, 2, 0, 1, 2, 0, 0, 2, 1, 0, 1, 0, 2, 1, 1, 1, 2, 0, 1, 0, 2, 1, 2, 2, 0, 1, 0, 0, 2, 1, 0, 2, 0, 0, 0, 1, 2, 2, 1, 2, 0, 1, 2, 0, 1, 2, 0, 2, 1, 2, 0, 1, 2, 1]","['How can oxytocin be used for people with autism, according to the researchers?', 'What is the effectiveness of non-oxytocin treatments for social problems caused by autism?', 'What were the two different groups in the experiment?', 'What is one reason Pelphrey warns against buying oxytocin online?', 'What is currently known about the benefits and side effects of oxytocin?', 'What does Frith say is a result of the oxytocin study?', 'Why does Yarrell mention that octopuses live alone?', ""Why does Inky's escape make sense to Yarrell?"", 'Why does the article mention Ozymandias?', 'How was Inky before coming to the aquarium?', 'What does Pullman think about pirating?', 'What does Pullman find outrageous?', 'According to Casserly, what does the current copyright law prevent artists from doing?', ""What is the purpose of Pullman's quote?"", 'Who does the BPI expect will drive change in copyright policy?', ""What are some of the effects of following Dr. Kelley's suggestion?"", 'What does Kelly say about the wake-up time of 18-year-olds?', 'Why does Kelley say that going to bed earlier is not the solution to waking up earlier?', ""Starting in adolescence, how does a person's average sleep loss per night change as they age, according to Kelley?"", 'Who would arrive to work earliest if workplaces introduce the staggered starting times described in the passage?', 'According to Kelley, what creates difficulties for parents in the morning?', ""How does the car passenger's phone interact with the car?"", 'Who does Brin say the car will benefit?', ""Could Google's cars be purchased at the time that the article was written?"", 'Why are detailed, high-quality scans of the road needed?', 'Approximately how many taxi drivers are there in the UK?', ""How will Volvo's cars contrast with Google's cars?"", ""Getting where you want to go with Google's new car will ..."", 'When will the FAA release regulations on drones?', 'What does Professor Singh think about fixing current drone delivery problems?', 'What currently happens to a typical drone if it loses contact with its human operator?', 'What is one way to increase drone safety, according to Huber?', 'Why does Singh bring up the example of passenger airplanes?', 'What does the study say about the fitness of children born in April or June?', 'What did the study find about stamina, handgrip strength and lower-body power of children?', 'What can small differences in physical performance determine?', ""What does Steele say is “a major factor” in the development of a child's athletic abilities?"", 'Where does Dunamn believe the athletic abilities of adults are derived from?', 'What was true about tourism in Agios Efstratios before the recent financial crisis?', 'Where do island residents have to travel to get cash?', 'How many tourists will likely visit the island this season compared to previous years?', 'Why are things generally more expensive in Agios Efstratios, according to Provatas Costas?', 'Why did people consider the islands as remote and obscure?', 'What is among the primary attractions of Lemnos?', 'What will Kakali do if Agios Efstratios has to pay the proposed tax increase?', 'Where did the Mesolithic man live?', 'What did the DNA test reveal about human immune systems?', 'What can be inferred about the Mesolithic cavemen based on items found in the cave?', 'Which of these nationalities has DNA most closely related to Mesolithic hunter-gatherers?', ""What was Duran's relationship to anti-capitalist projects?"", 'What was the money Duran took from the banks used for?', 'How did Duran obtain a lot of money in 2007?', ""How much prison time would Duran have to serve if he hadn't fled Spain?"", 'Who does Duran plan to share the knowledge he gained with?']","['It can reduce their anxiety levels', 'They have no significant effect', 'One received oxytocin through injections; the other through a nose spray', 'More research still needs to be done', 'Oxytocin has negative side effects while little is known about its potential benefits', 'Oxytocin can increase interest in faces', 'To explain why octopuses are different from most other sea creatures', 'Inky always liked to explore to pipes', 'To give an example of the cleverness of octopuses', 'He was not doing well', 'He disapproves of people who are OK with pirating', 'That his book is one of the most pirated books on the Internet', 'Imagining new possibilities for protecting their work', 'It conveys how strikingly well legal downloading services like iTunes work', 'Weatherly and copyright supporters', 'Better performance at school and improved health', 'It naturally varies over the course of the week', 'It would interfere with the rhythm of activity of certain eye cells', 'It highly depends on the individual', 'People in their 50s and older', 'Driving in the morning', ""It keeps track of the car's speed so that it does not exceed 25 miles per hour"", 'People who find driving very relaxing', 'Yes, but only by signing up for a special testing program', 'Because the cars cannot collect and process enough information in real time', '100,000', 'Volvos will have an emergency stop button', 'be very easy', 'June 2016, or before', 'He believes that his company will be the first to offer solutions to the problems', 'It will automatically return to its launch site', 'Have drones fly shorter distances', 'To show how many precautions people take when dealing with aircraft', 'They are stronger than all children, except those born in November and October', 'They were similar for children coming from similar family backgrounds', 'Whether a person will become a professional athlete', 'The extent to which their parents are interested in sports', 'A combination of multiple different factors', 'A small number of tourists visited Agios Efstratios each summer', 'To the city of Athens', 'More tourists, since the weather is forecasted to be good', 'The high price of milk and bread makes other products more expensive', 'They did not have any tourism infrastructure for 30 years', 'Beaches constantly full of locals and tourists', 'Visit the government with kids from Agios Efstratios', 'Africa', 'Since the time of the hunter-gatherers, immune systems have been dependent on a healthy diet', 'They hunted with sophisticated weapons', 'Northern European', 'He was opposed to them', 'Aid for unemployed and homeless people', 'He struck a deal with a television production company', 'Up to eight years', 'The general public']",1019.0,L,8:25,True,Marisa,78.75,91,"at one point it took about 10 tries to recalibrate, but it was right before a break so it was most likely eye fatigue from staring at the screen",,-1,,,,,,,,,False,,,,,,
l14_1085,69.0,55.0,"[3, 4, 5, 6, 7, 8, 9, 10, 11, 12, 13, 14, 15, 16, 17, 18, 19, 20, 21, 22, 23, 24, 25, 26, 27, 28, 29, 30, 31, 32, 33, 34, 35, 36, 37, 38, 39, 40, 41, 42, 43, 44, 45, 46, 47, 48, 49, 50, 51, 52, 53, 54, 55, 56]","[3, 4, 5, 6, 7, 8, 9, 10, 11, 12, 13, 15, 16, 17, 18, 19, 20, 21, 22, 23, 24, 25, 26, 27, 28, 29, 30, 31, 33, 34, 35, 36, 37, 38, 39, 41, 42, 43, 44, 45, 46, 47, 48, 49, 50, 51, 52, 55, 56, 57, 58, 59, 60, 61]",4,5,54,55.70818333333333,65.0045,"[42230, 40132, 29429, 59581, 45934, 61730, 54253, 43681, 49286, 50851, 63329, 54376, 66683, 86608, 35094, 49112, 44706, 41786, 50648, 71167, 67325, 55919, 86620, 44423, 44601, 43633, 23265, 78161, 46291, 32452, 53310, 40183, 50239, 50020, 45279, 38414, 44487, 47325, 30692, 45539, 42068, 68038, 48999, 49465, 36497, 66179, 62045, 56608, 46025, 66674, 57814, 52994, 43372, 22265]",68.96748333333333,133.97198333333333,R,371,6.659703795761904,92.36313432835821,"[3, 8, 3, 9, 3, 11, 12, 5, 7, 6, 9, 4, 16, 21, 7, 9, 5, 3, 7, 12, 7, 3, 10, 5, 2, 7, 1, 9, 4, 1, 5, 6, 8, 6, 7, 2, 5, 6, 3, 2, 3, 7, 2, 5, 1, 6, 6, 3, 2, 7, 4, 9, 4, 1]","[68.33, 75.25, 70.33, 73.89, 70.67, 74.91, 83.58, 43.6, 74.29, 78.33, 69.89, 88.75, 107.88, 149.86, 74.86, 74.33, 79.8, 78.33, 79.57, 71.08, 86.86, 78.0, 80.3, 88.8, 65.0, 80.0, 67.0, 83.44, 96.0, 64.0, 96.6, 89.5, 79.75, 97.0, 82.0, 90.5, 91.6, 86.5, 82.0, 77.5, 89.67, 406.57, 90.5, 90.4, 64.0, 74.17, 161.17, 73.67, 78.5, 93.71, 88.25, 86.11, 92.75, 94.0]",n,1,14,"[10, 10, 10, 10, 10, 10, 10, 8, 8, 8, 8, 8, 4, 4, 4, 4, 4, 5, 5, 5, 5, 5, 1, 1, 1, 1, 1, 1, 1, 6, 6, 6, 6, 7, 7, 7, 7, 3, 3, 3, 3, 3, 9, 9, 9, 9, 9, 9, 2, 2, 2, 2, 2, 2]","[1, 1, 1, 1, 1, 1, 1, 2, 2, 2, 2, 2, 3, 3, 3, 3, 3, 4, 4, 4, 4, 4, 5, 5, 5, 5, 5, 5, 5, 6, 6, 6, 6, 7, 7, 7, 7, 8, 8, 8, 8, 8, 9, 9, 9, 9, 9, 9, 10, 10, 10, 10, 10, 10]","['Ele', 'Adv', 'Ele', 'Ele', 'Ele', 'Adv', 'Adv', 'Adv', 'Ele', 'Ele', 'Ele', 'Adv', 'Adv', 'Adv', 'Ele', 'Ele', 'Adv', 'Ele', 'Ele', 'Adv', 'Ele', 'Adv', 'Adv', 'Adv', 'Ele', 'Ele', 'Ele', 'Adv', 'Ele', 'Ele', 'Adv', 'Ele', 'Adv', 'Adv', 'Adv', 'Ele', 'Ele', 'Ele', 'Adv', 'Ele', 'Adv', 'Adv', 'Adv', 'Ele', 'Ele', 'Adv', 'Adv', 'Adv', 'Ele', 'Ele', 'Adv', 'Adv', 'Adv', 'Ele']","[2, 0, 2, 2, 2, 0, 0, 0, 2, 2, 2, 0, 0, 0, 2, 2, 0, 2, 2, 0, 2, 0, 0, 0, 2, 2, 2, 0, 2, 2, 0, 2, 0, 0, 0, 2, 2, 2, 0, 2, 0, 0, 0, 2, 2, 0, 0, 0, 2, 2, 0, 0, 0, 2]","[1, 2, 3, 4, 5, 6, 7, 1, 2, 3, 4, 5, 1, 2, 3, 4, 5, 1, 2, 3, 4, 5, 1, 2, 3, 4, 5, 6, 7, 1, 2, 3, 4, 1, 2, 3, 4, 1, 2, 3, 4, 5, 1, 2, 3, 4, 5, 6, 1, 2, 3, 4, 5, 6]","[1, 0, 0, 1, 2, 1, 2, 1, 0, 1, 2, 0, 0, 2, 0, 2, 1, 1, 0, 0, 1, 2, 2, 0, 2, 0, 1, 1, 0, 2, 1, 2, 2, 1, 0, 1, 0, 2, 1, 1, 0, 2, 2, 2, 0, 2, 1, 0, 1, 2, 1, 2, 0, 0]","['What was true about tourism in Agios Efstratios before the recent financial crisis?', 'How has the closure of Greek banks affected the local residents of the island?', 'How many tourists will likely visit the island this season compared to previous years?', 'Why are things generally more expensive in Agios Efstratios, according to Provatas Costas?', 'Why did people consider the islands as remote and obscure?', 'Why does Lemnos have to pay the first round of tax increases?', ""Why wasn't Agios Efstratios one of the first islands to pay taxes?"", 'Who is Gavin Sandercock?', 'What did the study find about stamina, handgrip strength and lower-body power of children?', 'What can small differences in physical performance determine?', ""What does Steele say is “a major factor” in the development of a child's athletic abilities?"", 'What does Natalie Dunman note is a limitation to the study?', 'When does Amazon claim it will be ready to deliver packages using drones?', 'What is Professor Singh worried will happen when the drone is unable to access GPS signals?', 'What currently happens to a typical drone if it loses contact with its human operator?', 'What is one way to increase drone safety, according to Huber?', 'What does Singh say drones should do to improve safety?', 'What does Pullman think about pirating?', 'What does Pullman find outrageous?', ""What is Casserly's position on current copyright law?"", ""What is the purpose of Pullman's quote?"", 'Who states that copyright is meant to protect artists and producers?', 'What is unique about the controls of the car that Google just released?', ""What does Brin say his company's motivation is for making this car?"", ""Could Google's cars be purchased at the time that the article was written?"", 'Why are detailed, high-quality scans of the road needed?', 'Approximately how many taxi drivers are there in the UK?', 'Why did Google remove the steering wheel from their driverless car prototypes?', ""Getting where you want to go with Google's new car will ..."", 'Where did the Mesolithic man live?', 'What does Lalueza-Fox say about the study results?', 'What can be inferred about the Mesolithic cavemen based on items found in the cave?', 'How are Mesolithic hunter-gatherers currently portrayed through art?', 'Why did Inky escape, according to Yarrell?', 'How did Inky escape?', 'Why does the article mention Ozymandias?', 'How was Inky before coming to the aquarium?', ""What was Duran's relationship to anti-capitalist projects?"", ""What does Duran believe was wrong with Spain's economic system?"", 'How did Duran obtain a lot of money in 2007?', 'Why did Duran leave Spain?', 'How did Duran learn about the Spanish banking system?', 'What does Dr. Kelley suggest about the current starting time for schools?', 'What does Kelly say about the wake-up time of 18-year-olds?', 'Why does Kelley say that going to bed earlier is not the solution to waking up earlier?', 'Who has a greater average sleep loss than a 24 year old person?', 'According to Kelley, how will staggered starting times affect employees?', 'How might staggered starting times for work affect traffic, according to Kelley?', 'How can oxytocin be used for people with autism, according to the researchers?', 'What is the effectiveness of non-oxytocin treatments for social problems caused by autism?', ""What is the normal response of reward circuits in children's brains?"", 'What does Pelphrey think about buying oxytocin online?', 'What is one of the reasons scientists are uncertain about using oxytocin in real life?', 'What does Frith say is a result of the oxytocin study?']","['Tourists overcrowded Agios Efstratios', 'Some have moved to Athens to earn more money', 'More tourists, as all the hotels are already fully reserved for August', 'The products are of higher quality than on the mainland', 'They did not have any tourism infrastructure for 30 years', 'It has a large number of cultural sites', 'Because it is one of the smallest islands in Greece', 'The dean of Essex University', 'They were similar for children coming from similar family backgrounds', 'Whether a top-level sport is considered “elite”', 'The extent to which their parents are interested in sports', 'It examined too many unimportant factors in determining what makes a champion athlete', 'Once the FFA regulations are approved by Congress in 2017', 'It will have unreliable knowledge of its current location', 'It will fly around a certain area and look at every surface for a proper landing site', 'Inspect drones more frequently', 'They should land immediately in the event of a problem', 'He believes it is a robust defense against copyright laws', 'That someone pirating a book would not face consequences', 'It will allow artists to do more creative work', 'It informs that only 9% of people are fearful they might get caught when pirating music', 'Downing Street', 'It has special food pedals', 'Helping people who do not have good transportation today', 'No, they needed to go through more tests', 'Because the cars cannot collect and process enough information in real time', 'Unknown, as many drivers are not part of the UK National Taxi Association', 'People may not be able to assume control during an emergency', 'require using voice commands', 'Scientists have narrowed it to 7,000 plausible locations', 'They show how humans developed better immune systems to deal with infections from farm animals', 'They hunted with sophisticated weapons', 'As a diverse population of Europeans with varying skin tones', 'He wanted to disappear into the sea', 'Through an open pipe at the top of his tank', 'To convey that there were other octopuses in the aquarium', 'He was happier and calmer', 'He had ties with them that were cut after 14 months', 'Spain was not able to pay its debts', 'He leveraged the few bank loans he previously took out using his real details', 'He was sentenced to eight years in prison', 'Through his experience lying to banks to get loans', 'It can be detrimental to students with pre-existing health problems such as diabetes and depression', 'It is similar to the natural waking time of teachers', 'It would interfere with the rhythm of activity of certain eye cells', 'A 30-year-old person', 'They will find more creative solutions to problems', 'Rush hour would end earlier', 'It can effectively replace current treatments', 'They are highly effective but not perfect', 'Increased activity when looking at faces; decreased activity when looking at cars', ""He thinks it's too early to know if it will be sold online"", 'It may have harmful side effects', 'Oxytocin can increase interest in faces']",1085.0,L,1:10,False,Shrey,83.75,91,"had a slight problem with the seat being uncomfrtoable but was able to fix, really cooperative and everything went very smoothly",,-1,,,,,,,,,False,,,,,,
