RECORDING_SESSION_LABEL,comprehension_score_without_reread,comprehension_score_reread,trials,Trial_Index_,session_interruptions_(recalibrations),total_recalibrations,num_trials_without_recalibrations,session_duration,total_duration,DURATION,START_TIME,END_TIME,EYE_TRACKED,total_blinks,blinks_per_min,total_average_blink_duration,BLINK_COUNT,AVERAGE_BLINK_DURATION,batch_condition,batch,list,article_id,article_ind,level,level_ind,paragraph_id,q_ind,question,a,ID,dominant eye,Start Time,MIT/Technion,Experimenter,LEXTALE,Mich-Test,Experiment Notes,Survey notes,age,gender,native_speaker,home_country,english_speaking_country,stat_learning_english,years_in_english_country,percentage_in_en_country_out_of_life,additional_languages,balanced_bilinguals,education,affiliated,institution,multilingual,impairment,vision_impairment
l43_1010,74.0,91.0,"[3, 4, 5, 6, 7, 8, 9, 10, 11, 12, 13, 14, 15, 16, 17, 18, 19, 20, 21, 22, 23, 24, 25, 26, 27, 28, 29, 30, 31, 32, 33, 34, 35, 36, 37, 38, 39, 40, 41, 42, 43, 44, 45, 46, 47, 48, 49, 50, 51, 52, 53, 54, 55, 56]","[4, 6, 9, 11, 13, 14, 16, 17, 20, 21, 22, 25, 28, 29, 30, 32, 34, 35, 36, 37, 38, 39, 41, 44, 46, 48, 49, 52, 54, 55, 56, 58, 59, 60, 61, 63, 64, 65, 66, 67, 68, 73, 74, 76, 77, 78, 79, 80, 82, 84, 86, 88, 89, 91]",32,46,54,83.25411666666668,136.52203333333333,"[66306, 82973, 88928, 61319, 66287, 99944, 48557, 118135, 76674, 51363, 71251, 75892, 66075, 46227, 73238, 78593, 70065, 68744, 41681, 40259, 64904, 67661, 97012, 106849, 76322, 63610, 62516, 58363, 72112, 75922, 115265, 51585, 89296, 77807, 83588, 102390, 94158, 62912, 78217, 105533, 86860, 82081, 94978, 53260, 56717, 64239, 66793, 72165, 53379, 51370, 65706, 40160, 50234, 91402]",48.978550000000006,185.50058333333334,L,1584,19.026086197539378,71.32985074626866,"[15, 21, 24, 23, 13, 32, 13, 36, 21, 15, 26, 13, 14, 16, 17, 17, 18, 29, 15, 13, 19, 23, 32, 43, 26, 17, 28, 21, 27, 29, 43, 24, 32, 25, 38, 43, 35, 21, 24, 53, 36, 27, 33, 20, 21, 18, 20, 20, 17, 14, 30, 11, 24, 28]","[54.0, 53.14, 70.38, 64.0, 63.54, 71.47, 66.31, 74.33, 74.57, 65.6, 76.85, 69.92, 50.36, 61.0, 75.47, 57.24, 70.17, 81.48, 72.4, 138.62, 68.58, 66.52, 71.59, 75.4, 86.35, 65.12, 78.04, 72.19, 79.74, 71.0, 75.56, 55.29, 75.81, 79.36, 74.79, 92.56, 76.71, 83.81, 96.88, 73.38, 86.81, 80.11, 69.88, 69.1, 66.95, 78.39, 64.55, 70.1, 81.12, 60.43, 64.93, 59.09, 69.46, 69.29]",n,1,43,"[6, 6, 6, 6, 5, 5, 5, 5, 5, 9, 9, 9, 9, 9, 9, 3, 3, 3, 3, 3, 10, 10, 10, 10, 10, 10, 10, 8, 8, 8, 8, 8, 4, 4, 4, 4, 4, 7, 7, 7, 7, 2, 2, 2, 2, 2, 2, 1, 1, 1, 1, 1, 1, 1]","[1, 1, 1, 1, 2, 2, 2, 2, 2, 3, 3, 3, 3, 3, 3, 4, 4, 4, 4, 4, 5, 5, 5, 5, 5, 5, 5, 6, 6, 6, 6, 6, 7, 7, 7, 7, 7, 8, 8, 8, 8, 9, 9, 9, 9, 9, 9, 10, 10, 10, 10, 10, 10, 10]","['Adv', 'Ele', 'Adv', 'Ele', 'Adv', 'Adv', 'Ele', 'Adv', 'Ele', 'Ele', 'Adv', 'Adv', 'Ele', 'Ele', 'Ele', 'Adv', 'Ele', 'Adv', 'Ele', 'Ele', 'Adv', 'Ele', 'Adv', 'Adv', 'Adv', 'Ele', 'Ele', 'Ele', 'Adv', 'Adv', 'Adv', 'Ele', 'Ele', 'Ele', 'Adv', 'Adv', 'Ele', 'Ele', 'Ele', 'Adv', 'Adv', 'Adv', 'Adv', 'Ele', 'Ele', 'Ele', 'Adv', 'Ele', 'Ele', 'Adv', 'Adv', 'Adv', 'Ele', 'Adv']","[0, 2, 0, 2, 0, 0, 2, 0, 2, 2, 0, 0, 2, 2, 2, 0, 2, 0, 2, 2, 0, 2, 0, 0, 0, 2, 2, 2, 0, 0, 0, 2, 2, 2, 0, 0, 2, 2, 2, 0, 0, 0, 0, 2, 2, 2, 0, 2, 2, 0, 0, 0, 2, 0]","[1, 2, 3, 4, 1, 2, 3, 4, 5, 1, 2, 3, 4, 5, 6, 1, 2, 3, 4, 5, 1, 2, 3, 4, 5, 6, 7, 1, 2, 3, 4, 5, 1, 2, 3, 4, 5, 1, 2, 3, 4, 1, 2, 3, 4, 5, 6, 1, 2, 3, 4, 5, 6, 7]","[2, 0, 2, 1, 1, 0, 2, 1, 1, 1, 2, 0, 1, 0, 2, 2, 0, 1, 2, 1, 1, 2, 0, 1, 2, 0, 1, 0, 0, 1, 2, 2, 2, 1, 0, 2, 0, 0, 2, 1, 0, 1, 2, 0, 1, 2, 0, 1, 2, 2, 0, 1, 0, 0]","['Where did the Mesolithic man live?', 'What did the DNA test reveal about human immune systems?', 'What can be inferred about the Mesolithic cavemen based on items found in the cave?', 'Which of these nationalities has DNA most closely related to Mesolithic hunter-gatherers?', 'What does Pullman think about pirating?', 'What does Pullman find outrageous?', 'According to Casserly, what does the current copyright law prevent artists from doing?', ""What is the purpose of Pullman's quote?"", 'Who does the BPI expect will drive change in copyright policy?', ""What are some of the effects of following Dr. Kelley's suggestion?"", 'What does Kelly say about the wake-up time of 18-year-olds?', 'Why does Kelley say that going to bed earlier is not the solution to waking up earlier?', ""Starting in adolescence, how does a person's average sleep loss per night change as they age, according to Kelley?"", 'Who would arrive to work earliest if workplaces introduce the staggered starting times described in the passage?', 'According to Kelley, what creates difficulties for parents in the morning?', ""What was Duran's relationship to anti-capitalist projects?"", 'What was the money Duran took from the banks used for?', 'How did Duran obtain a lot of money in 2007?', ""How much prison time would Duran have to serve if he hadn't fled Spain?"", 'Who does Duran plan to share the knowledge he gained with?', 'What was true about tourism in Agios Efstratios before the recent financial crisis?', 'Where do island residents have to travel to get cash?', 'How many tourists will likely visit the island this season compared to previous years?', 'Why are things generally more expensive in Agios Efstratios, according to Provatas Costas?', 'Why did people consider the islands as remote and obscure?', 'What is among the primary attractions of Lemnos?', 'What will Kakali do if Agios Efstratios has to pay the proposed tax increase?', 'What does the study say about the fitness of children born in April or June?', 'What did the study find about stamina, handgrip strength and lower-body power of children?', 'What can small differences in physical performance determine?', ""What does Steele say is “a major factor” in the development of a child's athletic abilities?"", 'Where does Dunamn believe the athletic abilities of adults are derived from?', 'When will the FAA release regulations on drones?', 'What does Professor Singh think about fixing current drone delivery problems?', 'What currently happens to a typical drone if it loses contact with its human operator?', 'What is one way to increase drone safety, according to Huber?', 'Why does Singh bring up the example of passenger airplanes?', 'Why does Yarrell mention that octopuses live alone?', ""Why does Inky's escape make sense to Yarrell?"", 'Why does the article mention Ozymandias?', 'How was Inky before coming to the aquarium?', 'How can oxytocin be used for people with autism, according to the researchers?', 'What is the effectiveness of non-oxytocin treatments for social problems caused by autism?', 'What were the two different groups in the experiment?', 'What is one reason Pelphrey warns against buying oxytocin online?', 'What is currently known about the benefits and side effects of oxytocin?', 'What does Frith say is a result of the oxytocin study?', ""How does the car passenger's phone interact with the car?"", 'Who does Brin say the car will benefit?', ""Could Google's cars be purchased at the time that the article was written?"", 'Why are detailed, high-quality scans of the road needed?', 'Approximately how many taxi drivers are there in the UK?', ""How will Volvo's cars contrast with Google's cars?"", ""Getting where you want to go with Google's new car will ...""]","['Africa', 'Since the time of the hunter-gatherers, immune systems have been dependent on a healthy diet', 'Their culture valued preserving bodies in caves', 'Spanish', 'He disapproves of people who are OK with pirating', 'That someone stealing a wallet would not be punished', 'Stealing the work of others', 'It informs people about the legal consequences of pirating', 'Weatherly and the prime minister', 'A change in natural sleep rhythms', 'It depends on how lazy they are', 'It is difficult to convince teenagers to go to bed earlier', 'It decreases as they age, balancing around when they reach the age of 55', 'People in their 30s and teenagers', 'Waking up their teenage kids', 'He supported them financially', 'Helping social activists have enough money for their basic needs', 'He leveraged the few bank loans he previously took out using his real details', 'Up to eight years', 'Non-profit organizations', 'Many tourism agencies gave awards to Agios Efstratios', 'To a bank on the same island that can take 9 hours to reach', 'More tourists, as all the hotels are already fully reserved for August', 'There are only three shops and two restaurants, so there is little competition between businesses', 'The financial crisis made ferries unreliable and slow', 'A large number of cultural destinations', 'Resign from her position to protest the government', 'They are stronger than all children, except those born in November and October', 'They changed significantly between 2007 and 2010 for all children', 'Whether a top-level sport is considered “elite”', 'The academic advantage of autumn-born children', 'The opportunities offered by UK Sport during their youth', 'Soon, but the exact date is not specified', 'He believes that his company will be the first to offer solutions to the problems', 'It will fly around a certain area and look at every surface for a proper landing site', 'Inspect drones more frequently', 'To demonstrate how often airplane parts fail', 'To propose that Inky escaped because there were too many people in the aquarium', 'Inky always liked to explore to pipes', 'To explain that octopuses like opening jars', 'He was friendly and popular', 'It can reduce their anxiety levels', 'They have no significant effect', 'One group looked at images of cars; the other looked at images of facial expressions', ""Oxytocin requires a doctor's prescription"", 'Not much; both have been debated for decades', 'Oxytocin can increase interest in faces', 'It processes the sensory information from the car and guides the car', 'People who find driving very relaxing', 'Yes, but only by signing up for a special testing program', 'Because California has thousands of miles of roads', 'Almost none, as most are now working for Uber and Lyft', 'Volvos will drive with more control', 'require using voice commands']",1010.0,L,8:30,True,Marisa,60.0,81,gaze drifts above when focusing on 'p',,-1,,,,,,,,,False,,,,,,
,,,,,,,,,,,,,,,,,,,,,,,,,,,,,,1015.0,L,8:07,False,Marisa,58.75,34,keeps closing his eyes after answering a question and vision got fatigued near the end,,-1,,,,,,,,,False,,,,,,
,,,,,,,,,,,,,,,,,,,,,,,,,,,,,,1017.0,R,10:44,False,Marisa,62.5,67,went well,,-1,,,,,,,,,False,,,,,,
,,,,,,,,,,,,,,,,,,,,,,,,,,,,,,1028.0,L,14:15,False,Marisa,61.25,62,"went extremely well, when calibrating L top left corner does not track (this is consistent with other participants)",,-1,,,,,,,,,False,,,,,,
l43_1127,70.0,58.0,"[3, 4, 5, 6, 7, 8, 9, 10, 11, 12, 13, 14, 15, 16, 17, 18, 19, 20, 21, 22, 23, 24, 25, 26, 27, 28, 29, 30, 31, 32, 33, 34, 35, 36, 37, 38, 39, 40, 41, 42, 43, 44, 45, 46, 47, 48, 49, 50, 51, 52, 53, 54, 55, 56]","[4, 5, 6, 7, 8, 10, 11, 12, 13, 14, 15, 16, 17, 18, 19, 20, 21, 22, 23, 24, 25, 26, 27, 28, 29, 30, 31, 32, 33, 34, 35, 36, 37, 38, 39, 40, 41, 42, 43, 44, 45, 47, 48, 49, 50, 51, 52, 53, 54, 55, 56, 58, 59, 60]",7,7,54,102.63841666666667,111.49613333333335,"[116159, 73091, 76863, 102503, 126767, 125564, 81181, 122172, 144949, 129848, 154303, 129575, 101272, 72579, 100622, 95106, 94632, 121400, 90900, 73475, 68350, 98057, 103896, 88341, 95250, 62639, 144476, 67440, 137047, 115293, 75295, 76266, 117250, 55147, 79527, 79088, 82026, 65975, 74689, 77245, 49508, 53710, 75631, 68134, 84327, 130431, 98776, 49628, 102777, 104638, 55378, 79134, 86178, 84154]",168.69478333333333,280.1909166666667,R,162,1.5783563821538555,72.5064705882353,"[0, 0, 0, 35, 11, 0, 0, 1, 0, 0, 17, 11, 3, 0, 13, 0, 0, 4, 0, 0, 1, 1, 1, 1, 1, 0, 4, 0, 1, 4, 0, 0, 2, 1, 1, 0, 0, 2, 1, 1, 0, 1, 0, 0, 2, 11, 4, 1, 4, 3, 1, 1, 1, 1]","[0.0, 0.0, 0.0, 106.94, 123.64, 0.0, 0.0, 43.0, 0.0, 0.0, 161.35, 96.91, 237.67, 0.0, 92.62, 0.0, 0.0, 80.25, 0.0, 0.0, 167.0, 324.0, 40.0, 133.0, 96.0, 0.0, 117.25, 0.0, 94.0, 84.5, 0.0, 0.0, 126.0, 222.0, 121.0, 0.0, 0.0, 100.5, 193.0, 10.0, 0.0, 166.0, 0.0, 0.0, 139.5, 96.09, 109.0, 176.0, 132.25, 75.0, 205.0, 119.0, 147.0, 189.0]",n,3,43,"[6, 6, 6, 6, 6, 6, 6, 3, 3, 3, 3, 3, 2, 2, 2, 2, 2, 8, 8, 8, 8, 8, 8, 4, 4, 4, 4, 4, 7, 7, 7, 7, 7, 7, 7, 10, 10, 10, 10, 10, 10, 9, 9, 9, 9, 5, 5, 5, 5, 1, 1, 1, 1, 1]","[1, 1, 1, 1, 1, 1, 1, 2, 2, 2, 2, 2, 3, 3, 3, 3, 3, 4, 4, 4, 4, 4, 4, 5, 5, 5, 5, 5, 6, 6, 6, 6, 6, 6, 6, 7, 7, 7, 7, 7, 7, 8, 8, 8, 8, 9, 9, 9, 9, 10, 10, 10, 10, 10]","['Adv', 'Ele', 'Adv', 'Ele', 'Adv', 'Ele', 'Adv', 'Ele', 'Ele', 'Adv', 'Adv', 'Ele', 'Ele', 'Adv', 'Adv', 'Adv', 'Ele', 'Adv', 'Adv', 'Ele', 'Ele', 'Adv', 'Adv', 'Adv', 'Ele', 'Ele', 'Ele', 'Ele', 'Ele', 'Ele', 'Ele', 'Adv', 'Adv', 'Ele', 'Adv', 'Ele', 'Adv', 'Adv', 'Adv', 'Ele', 'Ele', 'Ele', 'Ele', 'Ele', 'Adv', 'Adv', 'Adv', 'Ele', 'Adv', 'Ele', 'Ele', 'Adv', 'Adv', 'Adv']","[0, 2, 0, 2, 0, 2, 0, 2, 2, 0, 0, 2, 2, 0, 0, 0, 2, 0, 0, 2, 2, 0, 0, 0, 2, 2, 2, 2, 2, 2, 2, 0, 0, 2, 0, 2, 0, 0, 0, 2, 2, 2, 2, 2, 0, 0, 0, 2, 0, 2, 2, 0, 0, 0]","[1, 2, 3, 4, 5, 6, 7, 1, 2, 3, 4, 5, 1, 2, 3, 4, 5, 1, 2, 3, 4, 5, 6, 1, 2, 3, 4, 5, 1, 2, 3, 4, 5, 6, 7, 1, 2, 3, 4, 5, 6, 1, 2, 3, 4, 1, 2, 3, 4, 1, 2, 3, 4, 5]","[0, 2, 1, 1, 2, 0, 2, 1, 2, 0, 2, 0, 0, 0, 1, 2, 0, 1, 2, 2, 1, 2, 0, 1, 2, 1, 2, 1, 1, 0, 2, 1, 0, 0, 0, 2, 0, 1, 2, 0, 1, 1, 0, 2, 1, 0, 2, 0, 1, 1, 2, 2, 0, 1]","['Who is Larry Pizzi?', 'What is true of the e-bike market in China?', 'What is one limitation of e-bikes?', 'What is true of e-bike prices?', 'Who or what is DiCostanza?', 'Who are the customers of Pedego, according to Don DiCostanza?', 'According to Pizzi, what is one benefit of the “cargo bike”?', 'Who mentions that it might be possible to see the northern lights?', 'What is one criteria the International Dark-Sky Association looks for when awarding Dark Sky Park status to a park?', 'According to Duncan Wise, what do people normally consider as “landscape”?', 'What will £14 million be used for?', 'What was created in 2011?', ""What has happened to Nepal's royal bengal tiger population over the past five years?"", 'What do international gangs do?', 'What is one consequence of the increase in the number of tigers in Nepal?', 'What happened in May?', 'What happened in India in 2013, according to Dhakal?', 'What happened to almost 1,200 people?', 'Where do one million people live?', 'What happened in the room Tatyana Bets worked in?', 'Who was in shock, according to Bets?', 'What took place in the first few hours after the incident?', 'What did Vladimir Zhirinovsky say?', 'What does the Japanese government want workers to do now?', 'What are British workers likely to think about a four-night vacation?', 'What is increasingly happening to Japanese employees because of work?', ""What does Yuu Wakebe's quote convey about working in Japan?"", 'What makes around 200 people die every year in Japan?', ""What was the main premise of Carle's television documentary?"", 'What do the rules of the experiment allow Carle to do?', ""What is true about Carle's underpants prior to their replacement?"", 'Why was driving a Peugeot car not possible?', ""Why does Carle's girlfriend ask him if he is crazy?"", 'What happened at the end of the experiment?', 'What is Carle not sure of when it comes to T-shirts produced in Morocco?', 'How did Angela Erdmann find out about the bottle?', ""What did Angela's visitor deliver?"", 'What does Holger von Neuhoff say about the bottled message?', 'Where did Richard Platz want the postcard to end up?', 'Which of the following characteristics does Angela Erdman share with her grandfather?', 'What does Erdmann want to add to the bottle exhibit?', 'Why are the people in the room lucky?', 'What do the classes at the center do?', ""Why do Zhorna's brothers both work instead of attending school?"", 'What statistic does UNICEF provide about children in Bangladesh?', ""Where does the lonely old man appear in John Lewis's advertisement?"", 'What does the old man receive from the girl?', 'Who performs a song for the campaign?', ""Who does Swift hope will like John Lewis' 2015 advertisement?"", 'How does the mirror technology used in the power plant differ from familiar roof panels?', 'What will happen once the four plants are finished?', ""By 2020, two-thirds of Morocco's renewable energy will be ..."", 'What is true of the south of Morocco and Mauritania?', 'How could solar energy be used in the future?']","['The CEO of the first company to sell e-bikes in the US', 'It was the largest e-bike market in the world as of 2014', 'They are usually heavier than normal bikes', 'They cost at least $1,500', 'A company that makes and sells electric bikes', 'High-tech employees', 'It is very stable compared to other bikes', 'Members of a team of astronomers at Kielder Observatory', ""Whether the park's night sky is sufficiently dark"", 'Everything that can be appreciated all year round', 'A complex of hotels', 'A Dark Sky Reserve', 'It has increased by 500 tigers in five protected areas', 'Use tiger skins for clothing', 'More people are killed by tigers in villages', 'The government announced a ban on tiger hunting', 'There were demonstrations against tiger-hunting', 'They were brought to the hospital', 'In Kazakhstan', 'Its reception desk was impacted by a meteorite', 'Children', 'A lot of press coverage and media speculation about the meteorite', 'That the event demonstrates how vulnerable Russia is', 'Take more days off', 'That it would not be enough if it were only vacation they took during the year', 'They are losing touch with their families', 'That cultural norms prevent Japanese workers from taking vacations', 'Long work schedules', 'Trying not to use products manufactured outside of France', 'Spend over €1,800 a month on French food', 'They were made by Calvin Klein', 'Peugeots are not manufactured in France', 'Because he is happy living without a refrigerator', 'Carle is awarded with a medal', 'Whether his friends would buy them', 'She coincidentally saw it at the museum where it was held', 'News of the discovery of the bottle', 'It is the oldest message found along with the bottle he has ever encountered', 'In the hands of whomever found it', 'Open-mindedness', ""Pictures of the bottled message's author"", 'Their parents can afford sending them to a private school', 'Provide children additional homework', 'The nearest school is too far to commute to daily', '1.3 million children are employed in unsafe working conditions', 'In a department store', 'A note', 'Mariah Carey', '22 million YouTube viewers', 'Mirror technology is cleaner than hydro and wind power', 'They will be as large as the capital', 'Available for export to other countries', 'Electricity will be transported there from Noor 2 and 3', 'To make existing water less polluted']",1127.0,R,3:30,False,Jessica,66.25,83,went well!,,-1,,,,,,,,,False,,,,,,
,,,,,,,,,,,,,,,,,,,,,,,,,,,,,,1016.0,R,11:51,,Marisa,65.0,65,took a bit to get used to the controller,,-1,,,,,,,,,False,,,,,,
,,,,,,,,,,,,,,,,,,,,,,,,,,,,,,1018.0,R,13:53,False,Marisa,70.0,76,"went well, didn't take any breaks",,-1,,,,,,,,,False,,,,,,
