RECORDING_SESSION_LABEL,comprehension_score_without_reread,comprehension_score_reread,trials,Trial_Index_,session_interruptions_(recalibrations),total_recalibrations,num_trials_without_recalibrations,session_duration,total_duration,DURATION,START_TIME,END_TIME,EYE_TRACKED,total_blinks,blinks_per_min,total_average_blink_duration,BLINK_COUNT,AVERAGE_BLINK_DURATION,batch_condition,batch,list,article_id,article_ind,level,level_ind,paragraph_id,q_ind,question,a,ID,dominant eye,Start Time,MIT/Technion,Experimenter,LEXTALE,Mich-Test,Experiment Notes,Survey notes,age,gender,native_speaker,home_country,english_speaking_country,stat_learning_english,years_in_english_country,percentage_in_en_country_out_of_life,additional_languages,balanced_bilinguals,education,affiliated,institution,multilingual,impairment,vision_impairment
l54_1056,59.0,56.0,"[3, 4, 5, 6, 7, 8, 9, 10, 11, 12, 13, 14, 15, 16, 17, 18, 19, 20, 21, 22, 23, 24, 25, 26, 27, 28, 29, 30, 31, 32, 33, 34, 35, 36, 37, 38, 39, 40, 41, 42, 43, 44, 45, 46, 47, 48, 49, 50, 51, 52, 53, 54, 55, 56]","[3, 5, 6, 7, 8, 9, 10, 11, 12, 13, 15, 16, 17, 18, 19, 23, 24, 25, 26, 27, 29, 30, 31, 32, 33, 34, 35, 36, 37, 41, 43, 44, 45, 46, 47, 48, 49, 50, 51, 52, 53, 54, 55, 56, 57, 58, 59, 61, 62, 63, 64, 65, 66, 67]",7,11,54,48.7673,66.76486666666665,"[91393, 47279, 30194, 34178, 26558, 51869, 42747, 28485, 52609, 43584, 46749, 51896, 35050, 34785, 37459, 85303, 35540, 50599, 54083, 33544, 49200, 27182, 63629, 51361, 37483, 58297, 59905, 34077, 63728, 54232, 36729, 36153, 28471, 33863, 49944, 32743, 56333, 42140, 37956, 36544, 38971, 42397, 43888, 41137, 43119, 38114, 46354, 40661, 44758, 37140, 56552, 49324, 48788, 39702]",313.40495,380.16981666666663,R,689,14.128319591201482,82.44215384615386,"[21, 7, 15, 3, 8, 17, 4, 1, 3, 4, 11, 12, 3, 2, 2, 12, 1, 2, 11, 8, 6, 2, 3, 11, 9, 19, 12, 1, 6, 15, 11, 5, 6, 16, 16, 3, 8, 10, 15, 11, 13, 19, 16, 14, 6, 11, 23, 13, 20, 18, 16, 20, 11, 17]","[75.9, 59.86, 154.0, 48.67, 58.0, 267.47, 39.5, 55.0, 28.0, 25.75, 51.64, 58.0, 26.67, 51.5, 34.0, 46.17, 48.0, 131.5, 53.82, 57.12, 211.33, 418.5, 248.33, 69.55, 305.0, 75.42, 64.08, 43.0, 92.5, 79.53, 56.91, 52.6, 50.17, 69.81, 80.38, 52.67, 47.25, 59.6, 50.27, 51.09, 66.15, 63.32, 63.12, 79.93, 55.33, 93.27, 67.17, 75.92, 73.9, 60.22, 65.0, 74.6, 54.55, 52.0]",n,1,54,"[1, 1, 1, 1, 1, 1, 1, 5, 5, 5, 5, 5, 10, 10, 10, 10, 10, 10, 10, 9, 9, 9, 9, 9, 9, 4, 4, 4, 4, 4, 3, 3, 3, 3, 3, 6, 6, 6, 6, 2, 2, 2, 2, 2, 2, 8, 8, 8, 8, 8, 7, 7, 7, 7]","[1, 1, 1, 1, 1, 1, 1, 2, 2, 2, 2, 2, 3, 3, 3, 3, 3, 3, 3, 4, 4, 4, 4, 4, 4, 5, 5, 5, 5, 5, 6, 6, 6, 6, 6, 7, 7, 7, 7, 8, 8, 8, 8, 8, 8, 9, 9, 9, 9, 9, 10, 10, 10, 10]","['Adv', 'Adv', 'Ele', 'Ele', 'Ele', 'Adv', 'Ele', 'Ele', 'Ele', 'Adv', 'Ele', 'Adv', 'Ele', 'Adv', 'Ele', 'Ele', 'Ele', 'Adv', 'Adv', 'Adv', 'Ele', 'Ele', 'Adv', 'Adv', 'Adv', 'Adv', 'Adv', 'Ele', 'Ele', 'Adv', 'Ele', 'Adv', 'Ele', 'Adv', 'Adv', 'Ele', 'Adv', 'Ele', 'Adv', 'Ele', 'Ele', 'Adv', 'Adv', 'Adv', 'Ele', 'Adv', 'Ele', 'Ele', 'Ele', 'Adv', 'Adv', 'Adv', 'Ele', 'Ele']","[0, 0, 2, 2, 2, 0, 2, 2, 2, 0, 2, 0, 2, 0, 2, 2, 2, 0, 0, 0, 2, 2, 0, 0, 0, 0, 0, 2, 2, 0, 2, 0, 2, 0, 0, 2, 0, 2, 0, 2, 2, 0, 0, 0, 2, 0, 2, 2, 2, 0, 0, 0, 2, 2]","[1, 2, 3, 4, 5, 6, 7, 1, 2, 3, 4, 5, 1, 2, 3, 4, 5, 6, 7, 1, 2, 3, 4, 5, 6, 1, 2, 3, 4, 5, 1, 2, 3, 4, 5, 1, 2, 3, 4, 1, 2, 3, 4, 5, 6, 1, 2, 3, 4, 5, 1, 2, 3, 4]","[1, 2, 1, 2, 0, 0, 2, 0, 2, 2, 0, 1, 0, 2, 2, 0, 1, 0, 1, 1, 1, 2, 1, 0, 2, 2, 1, 2, 1, 0, 1, 0, 0, 2, 1, 1, 0, 1, 1, 0, 1, 0, 1, 2, 2, 0, 2, 0, 1, 2, 0, 2, 0, 2]","[""How does the car passenger's phone interact with the car?"", 'Who does Brin say the car will benefit?', 'What will Google do now?', ""Why can't the driverless cars currently drive on all roads?"", 'Why is Conyon worried about driverless cars?', ""How will Volvo's cars contrast with Google's cars?"", 'What kind of accidents does Google pride itself in having managed to avoid during the testing phase of the car?', 'Where does Philip Pullman hold a senior position?', 'What does Pullman say about authors and musicians?', 'According to Casserly, what does the current copyright law prevent artists from doing?', 'What do the statistics in the paragraph convey?', 'Who does the BPI expect will drive change in copyright policy?', 'What event dramatically reduced the quality of life for residents in Agios Efstratios?', 'Where do island residents have to travel to get cash?', 'Who has said islands will stop getting their current tax breaks?', 'According to Kakali, what will happen in Agios Efstratios once the tax break ends?', 'What caused this tourism season to be the worst in 30 years?', 'What is among the primary attractions of Lemnos?', 'What will Kakali do if Agios Efstratios has to pay the proposed tax increase?', ""What are some of the effects of following Dr. Kelley's suggestion?"", 'Why does Kelley mention teachers in their 50s?', ""What does Kelley say is critical to people's sleep rhythms?"", ""Starting in adolescence, how does a person's average sleep loss per night change as they age, according to Kelley?"", 'Who would arrive to work earliest if workplaces introduce the staggered starting times described in the passage?', 'According to Kelley, what creates difficulties for parents in the morning?', 'When will the FAA release regulations on drones?', 'What does Professor Singh think about fixing current drone delivery problems?', ""What will Huber's program enable drones to do?"", 'What determines if a passenger plane is allowed to operate?', 'Why does Singh bring up the example of passenger airplanes?', 'How did Enric feel about taking money from banks?', 'What was the money Duran took from the banks used for?', ""Why did the banks reject Duran's loan applications at first?"", ""How much prison time would Duran have to serve if he hadn't fled Spain?"", 'Who does Duran plan to share the knowledge he gained with?', 'Which of these foods would the Mesolithic man find difficult to digest?', 'What did the DNA test reveal about human immune systems?', 'Where were reindeer teeth found?', 'Which of these nationalities has DNA most closely related to Mesolithic hunter-gatherers?', 'What difference did oxytocin make to the brains of autistic children, as shown in brain scans?', 'What are the results of Oxytocin experiments so far?', 'What were the two different groups in the experiment?', 'What is one reason Pelphrey warns against buying oxytocin online?', 'What is currently known about the benefits and side effects of oxytocin?', 'Why does Firth advocate for demonstrating behavioral effects of oxytocin?', 'What does the study say about the fitness of children born in April or June?', ""What was one measure the scientists used to assess the children's fitness?"", 'What are percentages used for in the passage?', 'What is one effect of a high-quality first sports experience, according to Steele?', 'Where does Dunamn believe the athletic abilities of adults are derived from?', 'Why does Yarrell mention that octopuses live alone?', ""Why does Inky's escape make sense to Yarrell?"", 'How good is the security of the aquarium, according to Jenkinson?', 'Why was Inky in poor shape before coming to the aquarium?']","['It tells the car where the user wants to go', ""People who can't afford current cars"", 'Test-pilot the cars', 'Pushback from traditional car companies', 'He is alarmed by their safety record compared to taxis driven by humans', 'Volvos will have an emergency stop button', ""Accidents that damage the car's computer"", 'The “Arts Union”', 'They rarely get recognized for their contributions', 'Stealing the work of others', 'How pirating frequency has changed between November 2012 and January 2013', 'The general public and copyright activists', 'The installment of a new government', 'To the post office', 'A newspaper reporter', 'Its residents will have to pay a 23% sales tax', 'Introduction of bank controls', 'A large number of cultural destinations', 'Encourage young people to leave Agios Efstratios', 'A change in natural sleep rhythms', 'To explain how unnatural it is for teenagers to wake up at 7am', 'Heart rate', 'It increases as they age until they reach the age of 55', 'People who go to bed early', 'Not having enough personal time', 'June 2016, or before', 'He believes the problems might be too difficult to fix', 'Identify mountains and hills', 'The number of times it has been inspected within one week prior to take off', 'To demonstrate how drones should perform when they need to come down on a busy highway', ""He was sorry he wasn't able to take more money"", 'Aid for unemployed and homeless people', 'The banks suspected he was trying to learn how the banking system operates', 'One year (the year 2013)', 'Members of the Spanish anti-capitalist movement', 'Foods containing lactose', 'Humans had strong immune systems even before they started farming', 'Next to cave carvings', 'European, with the exception of Sweden and Finland', 'Improved responses to faces', 'No experiments have been conducted so far', 'One received oxytocin through injections; the other through a nose spray', ""Oxytocin requires a doctor's prescription"", 'Oxytocin has negative side effects while little is known about its potential benefits', 'To show that oxytocin might change brain activity', 'They tend to be particularly good at sports', 'Time needed to run a mile', 'To show how even small differences in physical performance affect selection for elite sports', 'Increased exposure to vitamin D due to spending more time outside', 'The month in which they were born in', 'To provide evidence that Inky did not escape because he was lonely', 'Inky has been known to surprise people', 'Not effective, as crabs and other creatures have been stolen in the past', 'Because he fought with fish on a reef']",,,,,,,,,,-1,,,,,,,,,False,,,,,,
l55_1014,85.0,92.0,"[3, 4, 5, 6, 7, 8, 9, 10, 11, 12, 13, 14, 15, 16, 17, 18, 19, 20, 21, 22, 23, 24, 25, 26, 27, 28, 29, 30, 31, 32, 33, 34, 35, 36, 37, 38, 39, 40, 41, 42, 43, 44, 45, 46, 47, 48, 49, 50, 51, 52, 53, 54, 55, 56]","[3, 5, 6, 7, 8, 9, 10, 11, 12, 13, 14, 15, 16, 17, 18, 19, 20, 21, 22, 23, 26, 27, 28, 29, 30, 31, 32, 33, 34, 35, 36, 37, 38, 39, 41, 42, 43, 44, 45, 47, 48, 49, 50, 51, 52, 53, 54, 55, 56, 57, 59, 60, 61, 62]",6,8,54,52.5006,68.41083333333334,"[75838, 68071, 70603, 56658, 41746, 50886, 46774, 79358, 71311, 60789, 59782, 41315, 58850, 47386, 41076, 46690, 33995, 30723, 60335, 38588, 53384, 35621, 71263, 49059, 35265, 32793, 52681, 27825, 21219, 46220, 42476, 45006, 60463, 33048, 32538, 39090, 32963, 51241, 39123, 54001, 42292, 52849, 43845, 43491, 50823, 47532, 48973, 26939, 48212, 65905, 35604, 35940, 32309, 39977]",35.25668333333333,103.66751666666667,L,695,13.237943947307269,141.6059420289855,"[19, 23, 23, 18, 8, 9, 11, 26, 26, 16, 18, 12, 9, 18, 14, 15, 9, 5, 22, 7, 14, 8, 20, 9, 5, 3, 7, 6, 4, 2, 11, 9, 15, 6, 6, 8, 4, 8, 5, 6, 9, 9, 11, 10, 7, 12, 13, 3, 8, 11, 5, 8, 4, 9]","[121.0, 112.04, 121.3, 111.0, 128.88, 115.44, 142.36, 116.69, 143.0, 117.69, 123.44, 110.08, 97.56, 130.0, 330.14, 141.4, 115.33, 179.2, 166.68, 286.0, 202.64, 110.88, 132.65, 131.22, 101.4, 136.33, 163.14, 138.67, 100.75, 84.5, 177.91, 203.11, 142.4, 159.83, 145.5, 160.0, 130.25, 119.88, 102.8, 113.33, 133.78, 177.22, 104.64, 248.6, 456.29, 145.08, 95.15, 133.0, 120.38, 99.09, 127.8, 87.25, 88.0, 163.0]",n,1,55,"[4, 4, 4, 4, 4, 10, 10, 10, 10, 10, 10, 10, 1, 1, 1, 1, 1, 1, 1, 5, 5, 5, 5, 5, 3, 3, 3, 3, 3, 9, 9, 9, 9, 9, 9, 6, 6, 6, 6, 7, 7, 7, 7, 8, 8, 8, 8, 8, 2, 2, 2, 2, 2, 2]","[1, 1, 1, 1, 1, 2, 2, 2, 2, 2, 2, 2, 3, 3, 3, 3, 3, 3, 3, 4, 4, 4, 4, 4, 5, 5, 5, 5, 5, 6, 6, 6, 6, 6, 6, 7, 7, 7, 7, 8, 8, 8, 8, 9, 9, 9, 9, 9, 10, 10, 10, 10, 10, 10]","['Ele', 'Ele', 'Adv', 'Adv', 'Ele', 'Adv', 'Ele', 'Adv', 'Adv', 'Adv', 'Ele', 'Ele', 'Ele', 'Ele', 'Adv', 'Adv', 'Adv', 'Ele', 'Adv', 'Adv', 'Adv', 'Ele', 'Adv', 'Ele', 'Adv', 'Ele', 'Adv', 'Ele', 'Ele', 'Ele', 'Adv', 'Adv', 'Ele', 'Ele', 'Ele', 'Adv', 'Ele', 'Adv', 'Ele', 'Ele', 'Ele', 'Adv', 'Adv', 'Ele', 'Adv', 'Adv', 'Adv', 'Ele', 'Adv', 'Adv', 'Ele', 'Ele', 'Ele', 'Adv']","[2, 2, 0, 0, 2, 0, 2, 0, 0, 0, 2, 2, 2, 2, 0, 0, 0, 2, 0, 0, 0, 2, 0, 2, 0, 2, 0, 2, 2, 2, 0, 0, 2, 2, 2, 0, 2, 0, 2, 2, 2, 0, 0, 2, 0, 0, 0, 2, 0, 0, 2, 2, 2, 0]","[1, 2, 3, 4, 5, 1, 2, 3, 4, 5, 6, 7, 1, 2, 3, 4, 5, 6, 7, 1, 2, 3, 4, 5, 1, 2, 3, 4, 5, 1, 2, 3, 4, 5, 6, 1, 2, 3, 4, 1, 2, 3, 4, 1, 2, 3, 4, 5, 1, 2, 3, 4, 5, 6]","[2, 1, 0, 2, 0, 1, 2, 0, 1, 2, 0, 1, 1, 2, 2, 0, 1, 0, 0, 1, 0, 2, 1, 1, 2, 0, 1, 2, 1, 1, 2, 0, 1, 0, 2, 2, 0, 2, 1, 0, 2, 1, 0, 0, 0, 1, 2, 2, 1, 2, 0, 1, 2, 0]","['When will the FAA release regulations on drones?', 'What does Professor Singh think about fixing current drone delivery problems?', 'What currently happens to a typical drone if it loses contact with its human operator?', 'What is one way to increase drone safety, according to Huber?', 'Why does Singh bring up the example of passenger airplanes?', 'What was true about tourism in Agios Efstratios before the recent financial crisis?', 'Where do island residents have to travel to get cash?', 'How many tourists will likely visit the island this season compared to previous years?', 'Why are things generally more expensive in Agios Efstratios, according to Provatas Costas?', 'Why did people consider the islands as remote and obscure?', 'What is among the primary attractions of Lemnos?', 'What will Kakali do if Agios Efstratios has to pay the proposed tax increase?', ""How does the car passenger's phone interact with the car?"", 'Who does Brin say the car will benefit?', ""Could Google's cars be purchased at the time that the article was written?"", 'Why are detailed, high-quality scans of the road needed?', 'Approximately how many taxi drivers are there in the UK?', ""How will Volvo's cars contrast with Google's cars?"", ""Getting where you want to go with Google's new car will ..."", 'What does Pullman think about pirating?', 'What does Pullman find outrageous?', 'According to Casserly, what does the current copyright law prevent artists from doing?', ""What is the purpose of Pullman's quote?"", 'Who does the BPI expect will drive change in copyright policy?', ""What was Duran's relationship to anti-capitalist projects?"", 'What was the money Duran took from the banks used for?', 'How did Duran obtain a lot of money in 2007?', ""How much prison time would Duran have to serve if he hadn't fled Spain?"", 'Who does Duran plan to share the knowledge he gained with?', ""What are some of the effects of following Dr. Kelley's suggestion?"", 'What does Kelly say about the wake-up time of 18-year-olds?', 'Why does Kelley say that going to bed earlier is not the solution to waking up earlier?', ""Starting in adolescence, how does a person's average sleep loss per night change as they age, according to Kelley?"", 'Who would arrive to work earliest if workplaces introduce the staggered starting times described in the passage?', 'According to Kelley, what creates difficulties for parents in the morning?', 'Where did the Mesolithic man live?', 'What did the DNA test reveal about human immune systems?', 'What can be inferred about the Mesolithic cavemen based on items found in the cave?', 'Which of these nationalities has DNA most closely related to Mesolithic hunter-gatherers?', 'Why does Yarrell mention that octopuses live alone?', ""Why does Inky's escape make sense to Yarrell?"", 'Why does the article mention Ozymandias?', 'How was Inky before coming to the aquarium?', 'What does the study say about the fitness of children born in April or June?', 'What did the study find about stamina, handgrip strength and lower-body power of children?', 'What can small differences in physical performance determine?', ""What does Steele say is “a major factor” in the development of a child's athletic abilities?"", 'Where does Dunamn believe the athletic abilities of adults are derived from?', 'How can oxytocin be used for people with autism, according to the researchers?', 'What is the effectiveness of non-oxytocin treatments for social problems caused by autism?', 'What were the two different groups in the experiment?', 'What is one reason Pelphrey warns against buying oxytocin online?', 'What is currently known about the benefits and side effects of oxytocin?', 'What does Frith say is a result of the oxytocin study?']","['After June 2016', 'He believes that his company will be the first to offer solutions to the problems', 'It will automatically return to its launch site', 'Inspect drones more frequently', 'To show how many precautions people take when dealing with aircraft', 'Many tourism agencies gave awards to Agios Efstratios', 'To the post office', ""Fewer tourists, since tourism is more expensive now that the island's tax break has ended"", 'The high price of milk and bread makes other products more expensive', 'The financial crisis made ferries unreliable and slow', 'Beaches constantly full of locals and tourists', 'Encourage young people to leave Agios Efstratios', ""It keeps track of the car's speed so that it does not exceed 25 miles per hour"", 'People who find it difficult to travel around', 'Yes, but only in Detroit', 'Because people cannot collect and process enough information in real time', 'Unknown, as many drivers are not part of the UK National Taxi Association', 'Volvos will be capable of driving at higher speeds', 'require using voice commands', 'He disapproves of people who are OK with pirating', 'That authors and musicians work in poverty for years', 'Imagining new possibilities for protecting their work', 'It contrasts the time and effort of getting music legally with downloading it illegally', 'Weatherly and the prime minister', 'He had ties with them that were cut after 14 months', 'Aid for unemployed and homeless people', 'He took out extensive loans on behalf of a fake company', 'Two months', 'The general public', 'Better performance at school and improved health', 'It is naturally around 9am', 'It is difficult to convince teenagers to go to bed earlier', 'It continually adjusts to the hours of their working day until they reach the age of 55', 'People who are healthier and happier', 'Not having enough personal time', 'Spain', 'Humans had strong immune systems even before they started farming', 'They hunted with sophisticated weapons', 'Nationalities outside of Europe', 'To provide evidence that Inky did not escape because he was lonely', 'Inky always liked to explore to pipes', 'To convey that there were other octopuses in the aquarium', 'He was strong from fighting with fish', 'They tend to be particularly good at sports', 'They changed significantly between 2007 and 2010 for all children', 'Whether a person can compete in a lower weight class', 'The academic advantage of autumn-born children', 'A combination of multiple different factors', 'It can enhance the effectiveness of current treatments', 'They work for adults but not for children', 'One received oxytocin through injections; the other through a nose spray', ""He is afraid it will be used for conditions other than autism for which we don't yet have a treatment"", 'Oxytocin has about 45 known side effects, most of which are minor', 'Oxytocin leads to more accurate recognition of faces']",1014.0,L,11:19,True,Marisa,87.5,95,went well!,put her level as advanced but it definitely is more near-native due to the speed and accuracy she completed the test with,-1,,,,,,,,,False,,,,,,
,,,,,,,,,,,,,,,,,,,,,,,,,,,,,,1023.0,R,9:31,False,Diego,65.0,92,"would sometimes press A to try to proceed faster when staring the p/Q. Closed eye for a couple seconds trial 14. moved hair every once in a while. Took a longer break to stretch her neck, said she was straining her neck to have her forehead touch the bar since even with the chair as high up as possible she barely reached it. Readjusted chin rest break 1 to try to make her more comfortable. Again took longer break during break 2 to stretch neck and rest eyes, so I again readjusted chin rest during break. Eyes would fatigue staring at screen too long. Recalibrations often took multiple tries",,-1,,,,,,,,,False,,,,,,
,,,,,,,,,,,,,,,,,,,,,,,,,,,,,,1056.0,L,15:19,False,Diego,95.0,97,"Couldn't track left eye so tracked right. Sometimes giggled when she got a question wrong. Interrupted briefly by staff during trial 9, opened door of experiment room. More frequent recalibrations after break 1. At break 2, talked to me about the nature of the experiment, said it reminded her of English class, asked if it was normal to get questions wrong, if she was supposed to read in a particular way, etc. She told me she would read the full paragraphs at the beginning because she knew her eye was being tracked but then stopped reading fully later and instead focused on skimming to get questions right. I told her to just answer as best she could and that she can read the articles however she chooses. ",Didn't remember her exact score on the OET and could not access her score online to find it,-1,,,,,,,,,False,,,,,,
